Business Name,Link,Description
"THE 10 BEST Resorts near Miranjani, Abbottabad",https://www.tripadvisor.com/HotelsNear-g4366523-d10516527-zff8-Miranjani-Abbottabad_Khyber_Pakhtunkhwa_Province.html,Resorts near Miranjani · 1. Sunset Creek Resort · 2. Husnain Resort · 3. Hummingbird Resort & Executive Suites · 4. Marco Polo Resort Murree.
Summit Resorts (Republika Central),https://www.booking.com/hotel/pk/summit-resorts-republika-central.html,"Located in Abbottabad, Summit Resorts (Republika Central) offers 4-star accommodations with a garden, a shared lounge and a terrace."
"Republika by Summit Resorts, Abbottabad ...",https://www.booking.com/hotel/pk/republika-by-summit-resorts.html,"Providing a garden, Republika by Summit Resorts offers accommodations in Abbottabad. This property offers access to a terrace, free private parking, ..."
Khoj Resorts | Best Luxury Resort in Pakistan,https://www.khojresorts.com/,"At Khoj, we help you find what you are searching for, be it quality time away with family and friends, unique experiences, or extraordinary adventures."
Best Hotel In Abbottabad | Family | Honeymoon | Republika ...,https://republikabysummit.com/,Discover affordable accommodations and best hotel in Abbottabad. Republika Central & Republika Urban by Summit Resorts.
Republika by Summit Resorts - Abbottabad,https://www.tripadvisor.com/Hotel_Review-g4366523-d23345413-Reviews-Republika_by_Summit_Resorts-Abbottabad_Khyber_Pakhtunkhwa_Province.html,A perfect family friendly premises where you canTake a break from your busy life and let us host you with a very nominal charge. 100% privacy guaranteed.
Republika by Summit Resorts (@republikaofficial),https://www.instagram.com/republikaofficial/,Airbnb Superhost Sustainable level 3/3. Resorts | Suites| Campsite For Couples | Families | Corporate : Abbottabad | Qalanderabad | Raagen · 136 posts.
Shangrila Resort Hotel Skardu - Shangrila Hotel Pakistan,https://shangrilaresorts.com.pk/,Shangrila Resort Hotel Skardu is located around a serene heart shaped lake. Our cottages are dotted along the lakeside giving every room an awe inspiring view.
"Pine Park Hotel and Resorts, Shogran, Muzaffarabad ...",https://ar.trivago.com/en-145/oar/pine-park-hotel-and-resorts-shogran-muzaffarabad?search=100-18098194,"Our top-rated resorts in Muzaffarabad · Kutton Jagran Resort · Pearl Continental Hotel, Muzaffarabad · One Abbottabad · Mir Continental Hotel & Restaurant."
